{
  "id": "EP.E1.M02.A03",
  "titulo": "Especificar formato de saída sem deixar ambiguidade",
  "trilha": "EP",
  "estrato": 1,
  "modulo": 2,
  "aula": 3,
  "ambiente": "Mesa de Ensaio",
  "versao": "1.0.0",
  "duracao_min": 85,
  "leis": ["lei1", "lei2", "lei3", "lei4", "lei5"],
  "verificadores": [
    {
      "id": "v_json_puro",
      "descricao": "JSON puro, sem texto ao redor",
      "tipo": "regex",
      "parametros": { "padrao": "^\\s*\\{[\\s\\S]*\\}\\s*$" }
    },
    {
      "id": "v_esquema_estavel",
      "descricao": "Esquema e tipos estáveis entre execuções",
      "tipo": "estavel-entre-execucoes",
      "parametros": { "compara": "chaves-nivel-1-e-tipos" }
    },
    {
      "id": "v_quantidade_numero",
      "descricao": "Quantidade como número, não texto",
      "tipo": "tipo-de-campo",
      "parametros": { "caminho": "itens[].quantidade", "tipo": "number" }
    },
    {
      "id": "v_ausente_vira_null",
      "descricao": "Campo ausente vira null, nunca inventado",
      "tipo": "funcao-pura",
      "parametros": { "funcao": "entregaAusenteViraNull", "campo": "entrega" }
    }
  ],
  "fases": {
    "0_briefing": {
      "contexto": "A Distribuidora Vale Verde recebe pedido por WhatsApp o dia inteiro. Alguém digita tudo à mão no ERP — e erra. O ERP só aceita JSON, com contrato fixo: campo faltando derruba a integração e o pedido desaparece sem avisar ninguém.",
      "casos": [
        {
          "id": "a",
          "rotulo": "WhatsApp · caso A",
          "entrada": "Bom dia! preciso de 20 caixas de água 500ml e 5 fardo de coca 2l pra sexta feira. Mercado São Jorge"
        },
        {
          "id": "b",
          "rotulo": "WhatsApp · caso B — repare no que falta aqui",
          "entrada": "preciso repor: 15 fardos de cerveja lata. Padaria Trigo de Ouro"
        }
      ],
      "opcoes_leitura": [
        {
          "texto": "O modelo precisa escrever melhor o pedido",
          "detalhe": "Deixar o texto mais organizado e legível para quem digita no ERP.",
          "correta": false,
          "retorno": "Não é problema de redação. Ninguém vai ler esse texto — quem consome é o ERP, e ele não lê prosa. Reescrever bonito não resolve nada."
        },
        {
          "texto": "A saída precisa ter formato garantido, inclusive quando falta dado",
          "detalhe": "O ERP tem um contrato fixo. Sexta-feira existe no caso A e não existe no caso B.",
          "correta": true,
          "retorno": "Exato. O problema não é qualidade de texto, é contrato. E o caso B é o que separa uma solução que parece funcionar de uma que funciona: falta a data de entrega."
        },
        {
          "texto": "Falta treinar um modelo próprio para pedidos",
          "detalhe": "Um modelo específico da distribuidora entenderia melhor o vocabulário.",
          "correta": false,
          "retorno": "Custo enorme para um problema que é de especificação, não de capacidade. O modelo já entende o pedido — ele só não sabe em que formato devolver."
        }
      ],
      "trava": "A fase 1 abre quando você declarar a interpretação correta do problema."
    },
    "1_tentativa_cega": {
      "instrucao": "Sem instrução, sem exemplo, sem dica — é assim que a aula real começa. Escolha um prompt. Ele roda de verdade contra os dois casos e passa pelas quatro verificações do ERP.",
      "execucoes": [
        {
          "texto": "\"Extraia o pedido da mensagem do cliente e me devolva organizado.\"",
          "modo": "roteirizado",
          "saidas": {
            "a": "Pedido — Mercado São Jorge\n\n• 20 caixas de água 500ml\n• 5 fardos de Coca-Cola 2L\n\nEntrega: sexta-feira",
            "b": "Cliente: Padaria Trigo de Ouro\nItem: 15 fardos de cerveja em lata\nEntrega: a combinar"
          },
          "resultados_teste": {
            "v_json_puro": false,
            "v_esquema_estavel": false,
            "v_quantidade_numero": true,
            "v_ausente_vira_null": false
          },
          "diagnostico": "Prosa, com formato diferente em cada execução — e a entrega do caso B foi inventada do nada. O ERP rejeita os dois."
        },
        {
          "texto": "\"Você é um assistente de vendas. Leia a mensagem e liste os itens do pedido.\"",
          "modo": "roteirizado",
          "saidas": {
            "a": "Itens do pedido:\n1. Água 500ml — 20 caixas\n2. Coca-Cola 2L — 5 fardos\nCliente: Mercado São Jorge | Entrega: sexta",
            "b": "Itens do pedido:\n1. Cerveja lata — 15 fardos\nCliente: Padaria Trigo de Ouro"
          },
          "resultados_teste": {
            "v_json_puro": false,
            "v_esquema_estavel": false,
            "v_quantidade_numero": true,
            "v_ausente_vira_null": true
          },
          "diagnostico": "Mais consistente, mas continua sendo lista em markdown. Nenhuma integração consome isso sem um parser frágil no meio — e parser frágil quebra no primeiro pedido fora do padrão."
        },
        {
          "texto": "\"Extraia o pedido em JSON.\"",
          "modo": "roteirizado",
          "saidas": {
            "a": "{\"cliente\":\"Mercado São Jorge\",\"itens\":[{\"item\":\"água 500ml\",\"qtd\":\"20 caixas\"}],\"entrega\":\"sexta-feira\"}",
            "b": "{\"cliente\":\"Padaria Trigo de Ouro\",\"produtos\":[\"15 fardos de cerveja lata\"],\"entrega\":\"a combinar\"}"
          },
          "resultados_teste": {
            "v_json_puro": true,
            "v_esquema_estavel": false,
            "v_quantidade_numero": false,
            "v_ausente_vira_null": false
          },
          "diagnostico": "Este é o mais perigoso dos três. É JSON, então parece resolvido — mas as chaves mudaram entre as duas execuções (itens virou produtos), a quantidade veio como texto e a entrega do caso B foi inventada. Passa no teste do olho e quebra em produção."
        }
      ],
      "trava": "A fase 2 abre depois de você rodar pelo menos uma tentativa."
    },
    "2_descida": {
      "conceito": [
        "O modelo não escolhe formato: ele amostra entre continuações plausíveis. Especificar é encolher a nuvem de possibilidades até sobrar uma.",
        "Esquema literal com tipos vence descrição em prosa. Cole a estrutura que você quer, não a explique.",
        "Todo campo que pode faltar precisa de um valor decidido por você. Se você não decidir, o modelo decide — e ele inventa algo verossímil, que é pior que errar feio.",
        "A mensagem do cliente é dado, não instrução. Delimite explicitamente."
      ],
      "checagens": [
        {
          "pergunta": "Por que pedir \"em JSON\" não bastou?",
          "opcoes": [
            {
              "texto": "Porque o modelo não sabe gerar JSON",
              "correta": false,
              "retorno": "Ele sabe — gerou JSON válido nas duas execuções. O problema foi outro."
            },
            {
              "texto": "Porque \"JSON\" não define quais chaves, quais tipos, nem o que fazer com campo ausente",
              "correta": true,
              "retorno": "Isso. JSON é família de formatos, não um formato. Sem esquema literal, cada execução escolhe o dela."
            },
            {
              "texto": "Porque a mensagem do cliente estava mal escrita",
              "correta": false,
              "retorno": "A mensagem é o dado real que chega todo dia. Um sistema que só funciona com entrada limpa não funciona."
            }
          ]
        },
        {
          "pergunta": "O caso B não tem data de entrega. De quem é a decisão sobre o que colocar ali?",
          "opcoes": [
            {
              "texto": "Do modelo, que escolhe o valor mais provável",
              "correta": false,
              "retorno": "Foi exatamente isso que aconteceu — e ele escreveu \"a combinar\". Verossímil e errado. Em produção vira entrega em dia nenhum."
            },
            {
              "texto": "De quem escreve o prompt, que precisa decidir antes",
              "correta": true,
              "retorno": "Sim. Todo campo que pode faltar precisa de um valor definido por você. Se você não decidir, o modelo decide — e ele sempre preenche com algo plausível."
            },
            {
              "texto": "Do ERP, que preenche depois com o padrão",
              "correta": false,
              "retorno": "O ERP recusa o pedido antes disso. E mesmo que aceitasse, o erro já entrou no sistema disfarçado de dado bom."
            }
          ]
        }
      ],
      "trava": "A fase 3 abre com as duas checagens corretas. Errar não penaliza — só não abre."
    },
    "3_trabalho_no_fundo": {
      "instrucao": "Qual destes passa nas quatro verificações? Olhe o caso B, que não tem data de entrega. Três de quatro não abre a porta: aqui a verificação é a porta.",
      "execucoes": [
        {
          "texto": "Igual à anterior, acrescentando: \"Responda apenas o JSON, sem texto antes ou depois.\"",
          "modo": "roteirizado",
          "saidas": {
            "b": "{\"cliente\":\"Padaria Trigo de Ouro\",\"itens\":[{\"produto\":\"cerveja lata\",\"quantidade\":15,\"unidade\":\"fardo\"}],\"entrega\":\"a combinar\"}"
          },
          "resultados_teste": {
            "v_json_puro": true,
            "v_esquema_estavel": true,
            "v_quantidade_numero": true,
            "v_ausente_vira_null": false
          },
          "diagnostico": "Quase. O esquema estabilizou e a quantidade virou número — mas nada disse o que fazer quando o campo não existe, então o modelo preencheu de novo. Três de quatro não abre a porta."
        },
        {
          "texto": "Esquema literal com tipos, mais a regra explícita: campo ausente na mensagem = null, nunca deduzir. Mensagem do cliente delimitada como dado.",
          "modo": "roteirizado",
          "saidas": {
            "b": "{\n  \"cliente\": \"Padaria Trigo de Ouro\",\n  \"entrega\": null,\n  \"itens\": [\n    { \"produto\": \"cerveja lata\", \"quantidade\": 15, \"unidade\": \"fardo\" }\n  ]\n}"